{
  "cli_version": "2.1.195",
  "root": {
    "arguments": [
      {
        "description": "Your prompt",
        "name": "prompt",
        "provenance": "claude --help",
        "source": "cli-help"
      }
    ],
    "commands": [
      {
        "arguments": [],
        "commands": [],
        "description": "Manage background agents",
        "flags": [
          {
            "arg": "<directory>",
            "choices": null,
            "default": null,
            "description": "Additional directory to allow tool access to in dispatched sessions (repeatable)",
            "names": [
              "--add-dir"
            ],
            "provenance": "claude agents --help",
            "source": "cli-help"
          },
          {
            "arg": "<agent>",
            "choices": null,
            "default": null,
            "description": "Default agent for sessions dispatched from agent view. Overrides the 'agent' setting.",
            "names": [
              "--agent"
            ],
            "provenance": "claude agents --help",
            "source": "cli-help"
          },
          {
            "added_in": "2.1.170",
            "arg": null,
            "choices": null,
            "default": null,
            "description": "With --json: include completed sessions (the full agent view list)",
            "names": [
              "--all"
            ],
            "provenance": "claude agents --help",
            "source": "cli-help"
          },
          {
            "arg": null,
            "choices": null,
            "default": null,
            "description": "Make bypass-permissions mode available to dispatched sessions without defaulting to it",
            "names": [
              "--allow-dangerously-skip-permissions"
            ],
            "provenance": "claude agents --help",
            "source": "cli-help"
          },
          {
            "arg": "<path>",
            "choices": null,
            "default": null,
            "description": "Show only background sessions started under <path>",
            "names": [
              "--cwd"
            ],
            "provenance": "claude agents --help",
            "source": "cli-help"
          },
          {
            "arg": null,
            "choices": null,
            "default": null,
            "description": "Alias for --permission-mode bypassPermissions",
            "names": [
              "--dangerously-skip-permissions"
            ],
            "provenance": "claude agents --help",
            "source": "cli-help"
          },
          {
            "arg": "<level>",
            "choices": null,
            "default": null,
            "description": "Default effort level for sessions dispatched from agent view",
            "names": [
              "--effort"
            ],
            "provenance": "claude agents --help",
            "source": "cli-help"
          },
          {
            "arg": null,
            "choices": null,
            "default": null,
            "description": "Display help for command",
            "names": [
              "-h",
              "--help"
            ],
            "provenance": "claude agents --help",
            "source": "cli-help"
          },
          {
            "arg": null,
            "choices": null,
            "default": null,
            "description": "Print active sessions as a JSON array and exit (for scripting; does not require a TTY)",
            "names": [
              "--json"
            ],
            "provenance": "claude agents --help",
            "source": "cli-help"
          },
          {
            "arg": "<config>",
            "choices": null,
            "default": null,
            "description": "MCP server configuration to apply to dispatched sessions (repeatable)",
            "names": [
              "--mcp-config"
            ],
            "provenance": "claude agents --help",
            "source": "cli-help"
          },
          {
            "arg": "<model>",
            "choices": null,
            "default": null,
            "description": "Default model for sessions dispatched from agent view",
            "names": [
              "--model"
            ],
            "provenance": "claude agents --help",
            "source": "cli-help"
          },
          {
            "arg": "<mode>",
            "choices": null,
            "default": null,
            "description": "Default permission mode for sessions dispatched from agent view",
            "names": [
              "--permission-mode"
            ],
            "provenance": "claude agents --help",
            "source": "cli-help"
          },
          {
            "arg": "<path>",
            "choices": null,
            "default": null,
            "description": "Load plugins from specified directory for the agent view and dispatched sessions (repeatable)",
            "names": [
              "--plugin-dir"
            ],
            "provenance": "claude agents --help",
            "source": "cli-help"
          },
          {
            "arg": "<sources>",
            "choices": null,
            "default": null,
            "description": "Comma-separated list of setting sources to load (user, project, local).",
            "names": [
              "--setting-sources"
            ],
            "provenance": "claude agents --help",
            "source": "cli-help"
          },
          {
            "arg": "<file-or-json>",
            "choices": null,
            "default": null,
            "description": "Settings file or JSON string to apply to the agent view and dispatched sessions",
            "names": [
              "--settings"
            ],
            "provenance": "claude agents --help",
            "source": "cli-help"
          },
          {
            "arg": null,
            "choices": null,
            "default": null,
            "description": "Only use MCP servers from --mcp-config in dispatched sessions",
            "names": [
              "--strict-mcp-config"
            ],
            "provenance": "claude agents --help",
            "source": "cli-help"
          }
        ],
        "name": "agents",
        "path": [
          "agents"
        ],
        "provenance": "claude agents --help",
        "source": "cli-help",
        "usage": "claude agents [options]"
      },
      {
        "arguments": [],
        "commands": [
          {
            "arguments": [],
            "commands": [],
            "description": "Sign in to your Anthropic account",
            "flags": [
              {
                "arg": null,
                "choices": null,
                "default": null,
                "description": "Use Claude subscription (default)",
                "names": [
                  "--claudeai"
                ],
                "provenance": "claude auth login --help",
                "source": "cli-help"
              },
              {
                "arg": null,
                "choices": null,
                "default": null,
                "description": "Use Anthropic Console (API usage billing) instead of Claude subscription",
                "names": [
                  "--console"
                ],
                "provenance": "claude auth login --help",
                "source": "cli-help"
              },
              {
                "arg": "<email>",
                "choices": null,
                "default": null,
                "description": "Pre-populate email address on the login page",
                "names": [
                  "--email"
                ],
                "provenance": "claude auth login --help",
                "source": "cli-help"
              },
              {
                "arg": null,
                "choices": null,
                "default": null,
                "description": "Display help for command",
                "names": [
                  "-h",
                  "--help"
                ],
                "provenance": "claude auth login --help",
                "source": "cli-help"
              },
              {
                "arg": null,
                "choices": null,
                "default": null,
                "description": "Force SSO login flow",
                "names": [
                  "--sso"
                ],
                "provenance": "claude auth login --help",
                "source": "cli-help"
              }
            ],
            "name": "login",
            "path": [
              "auth",
              "login"
            ],
            "provenance": "claude auth login --help",
            "source": "cli-help",
            "usage": "claude auth login [options]"
          },
          {
            "arguments": [],
            "commands": [],
            "description": "Log out from your Anthropic account",
            "flags": [
              {
                "arg": null,
                "choices": null,
                "default": null,
                "description": "Display help for command",
                "names": [
                  "-h",
                  "--help"
                ],
                "provenance": "claude auth logout --help",
                "source": "cli-help"
              }
            ],
            "name": "logout",
            "path": [
              "auth",
              "logout"
            ],
            "provenance": "claude auth logout --help",
            "source": "cli-help",
            "usage": "claude auth logout [options]"
          },
          {
            "arguments": [],
            "commands": [],
            "description": "Show authentication status",
            "flags": [
              {
                "arg": null,
                "choices": null,
                "default": null,
                "description": "Display help for command",
                "names": [
                  "-h",
                  "--help"